{
  "schemaVersion": 1,
  "generatedAt": "2026-10-20T01:00:05Z",
  "signals": [
    {
      "see": "Sorted array + \"find a pair/triple summing to target\"",
      "reach": "two-pointer",
      "note": "converge from ends"
    },
    {
      "see": "Sorted, or \"smallest/largest x that works\", or \"find position\"",
      "reach": "binary-search",
      "note": "min/max boundary"
    },
    {
      "see": "\"Contiguous subarray/substring\" + a constraint (≤ k distinct, sum, longest/shortest)",
      "reach": "sliding-window",
      "note": ""
    },
    {
      "see": "\"Subarray sums to k\" / many range-sum queries",
      "reach": "prefix-sum",
      "note": "+ hashmap"
    },
    {
      "see": "\"Next greater/smaller\", spans, histogram, temperatures",
      "reach": "monotonic-stack",
      "note": ""
    },
    {
      "see": "\"Max/min in every window of size k\"",
      "reach": "monotonic-stack",
      "note": "monotonic deque"
    },
    {
      "see": "Intervals: \"merge/insert overlapping\" (→ a set)",
      "reach": "intervals",
      "note": "sort by start, sweep"
    },
    {
      "see": "Intervals: \"max that fit\" / \"min to remove\" / \"min arrows\" (→ a number)",
      "reach": "intervals",
      "note": "sort by end, greedy frontier"
    },
    {
      "see": "Linked list: \"cycle?\", \"middle\", \"find the duplicate number\"",
      "reach": "fast-slow-pointer",
      "note": ""
    },
    {
      "see": "Linked list: \"reverse\", reorder, palindrome",
      "reach": "in-place-reversal",
      "note": ""
    },
    {
      "see": "Linked list: head may change (insert/delete at front, merge)",
      "reach": "dummy-node",
      "note": ""
    },
    {
      "see": "\"Connected?\", \"how many groups/components\", cycle in an undirected graph",
      "reach": "union-find",
      "note": ""
    },
    {
      "see": "\"Prerequisites\", \"ordering\", \"can you finish\" (a DAG)",
      "reach": "topological-sort",
      "note": ""
    },
    {
      "see": "\"Shortest # of steps\" / \"level by level\" (unweighted)",
      "reach": "tree-bfs",
      "note": ""
    },
    {
      "see": "Tree property that depends on children (height, balanced, diameter)",
      "reach": "tree-dfs",
      "note": "DFS postorder"
    },
    {
      "see": "BST \"sorted output\" or \"validate\"",
      "reach": "tree-dfs",
      "note": "DFS inorder"
    },
    {
      "see": "\"All subsets / permutations / combinations\", \"find every way\"",
      "reach": "backtracking",
      "note": ""
    },
    {
      "see": "Overlapping subproblems / \"min/max/count ways\" with optimal substructure",
      "reach": "dynamic-programming",
      "note": ""
    },
    {
      "see": "\"Kth largest / smallest\", \"top k\", \"k closest\"",
      "reach": "heap",
      "note": "",
      "page": false
    },
    {
      "see": "\"Majority element\" (> n/2 or > n/3)",
      "reach": "Boyer-Moore voting",
      "note": "",
      "page": false
    },
    {
      "see": "Array of `1..n`, find the missing / duplicate",
      "reach": "cyclic sort",
      "note": "",
      "page": false
    },
    {
      "see": "\"Running median\" of a stream",
      "reach": "two heaps",
      "note": "",
      "page": false
    },
    {
      "see": "\"Kth largest\" and you want O(n) average, no full sort",
      "reach": "quickselect",
      "note": "",
      "page": false
    }
  ],
  "techniques": [
    {
      "id": "backtracking",
      "name": "Backtracking",
      "family": "backtracking",
      "tier": "core",
      "whenToUse": "Enumerate every candidate by extending a partial choice one step, recursing, then undoing it — the answer is the set of all arrangements, not a single best one.",
      "signals": [
        "\"All subsets / permutations / combinations\", \"find every way\"",
        "Explicit Item Resequencing",
        "Structural Choice Sequence Steps"
      ],
      "picking": {
        "feature": "The output is EVERY valid arrangement (all subsets / permutations / combinations), so exponential work is unavoidable — choose, recurse, un-choose.",
        "notWhen": [
          {
            "technique": "dynamic-programming",
            "because": "the question is a count / min / max over choices and the same sub-state recurs — cache states instead of enumerating every path"
          }
        ]
      },
      "variants": [
        {
          "title": "Permutations Pattern",
          "when": "Finding every possible layout variation of an items list where ordering determines unique results.",
          "code": "def permute(nums: list[int]) -> list[list[int]]:\n    result = []\n    \n    def backtrack(current_path: list[int]):\n        if len(current_path) == len(nums):\n            result.append(list(current_path))  # Store copy of path\n            return\n            \n        for i in range(len(nums)):\n            if nums[i] in current_path: continue  # Skip elements already used\n            current_path.append(nums[i])          # Save-state\n            backtrack(current_path)               # Recurse deep\n            current_path.pop()                    # Undo choice\n            \n    backtrack([])\n    return result",
          "complexity": {
            "time": "O(n · n!)",
            "space": "O(n)",
            "why": "n! complete permutations, each copied in O(n); the path and the recursion depth are both O(n) (the output list itself is not counted)"
          }
        },
        {
          "title": "Combinations and Subsets Pattern",
          "when": "Generating all variations of variable-length groupings where sequence arrangement is irrelevant.",
          "code": "def subsets(nums: list[int]) -> list[list[int]]:\n    result = []\n    \n    def backtrack(start_index: int, current_path: list[int]):\n        result.append(list(current_path))  # Append current subset progress\n        \n        for i in range(start_index, len(nums)):\n            current_path.append(nums[i])          # Make choice\n            backtrack(i + 1, current_path)        # Move index limit forward\n            current_path.pop()                    # Undo choice\n            \n    backtrack(0, [])\n    return result",
          "complexity": {
            "time": "O(n · 2ⁿ)",
            "space": "O(n)",
            "why": "2ⁿ subsets, each copied in up to O(n); recursion depth never exceeds n"
          }
        }
      ],
      "pitfalls": [
        "Appending the mutable path itself instead of a copy — every stored result later mutates into the same list",
        "Permutations restart `i` at 0 with a used-check; subsets start at `start_index` — mixing the two loop bounds yields duplicates or missing sets",
        "Forgetting to undo the choice after the recursive call (the `pop`) — the path leaks into sibling branches",
        "Skipping duplicates needs a sort first plus `if i > start and nums[i] == nums[i-1]: continue` — without the sort the check is meaningless"
      ],
      "keyProblems": [
        {
          "lcNumber": 46,
          "title": "Permutations"
        },
        {
          "lcNumber": 78,
          "title": "Subsets"
        }
      ],
      "docUrl": "https://github.com/michael-yrao/cse-coach/blob/main/docs/foundations/dsa/patterns/techniques/backtracking.md"
    },
    {
      "id": "binary-search",
      "name": "Binary Search",
      "family": "binary_search",
      "tier": "core",
      "whenToUse": "Binary search works on any monotonic yes/no boundary, not just sorted arrays. Use it when you can test a candidate answer cheaply and the search space is sorted or monotonically structured.",
      "signals": [
        "Sorted, or \"smallest/largest x that works\", or \"find position\""
      ],
      "picking": {
        "feature": "A yes/no predicate that flips exactly once across the search space — a sorted array, or a monotonic answer space like \"can finish at speed k\" — so halving the range is safe.",
        "notWhen": [
          {
            "technique": "two-pointer",
            "because": "you need a PAIR of positions meeting a condition, not one boundary — sorted input alone doesn't make it a binary search"
          },
          {
            "technique": "sliding-window",
            "because": "the thing you want is a contiguous run whose validity changes as it grows, not a single index"
          }
        ]
      },
      "variants": [
        {
          "title": "Exact Value Search",
          "when": "Find an exact target value in the array",
          "code": "if nums[mid] == target:\n    return mid  # Found exact match\nelif nums[mid] > target:\n    r = mid - 1  # Search left\nelse:\n    l = mid + 1  # Search right",
          "complexity": {
            "time": "O(log n)",
            "space": "O(1)",
            "why": "each step halves the candidate range; only two indices are held"
          }
        },
        {
          "title": "Minimum Boundary Search (First True Position)",
          "when": "Find the leftmost position where a monotonic predicate is true",
          "code": "if is_valid(mid):  # Predicate is true\n    r = mid  # Keep mid as candidate, search left\nelse:  # Predicate is false\n    l = mid + 1  # Move past mid, search right",
          "complexity": {
            "time": "O(log n · c)",
            "space": "O(1)",
            "why": "log n probes, each paying one predicate check costing c; `r = mid` keeps the valid candidate inside the range"
          }
        },
        {
          "title": "Maximum Boundary Search (Last True Position)",
          "when": "Find the rightmost position where a monotonic predicate is true",
          "code": "if is_valid(mid):  # Predicate is true\n    l = mid  # Keep mid as candidate, search right\nelse:  # Predicate is false\n    r = mid - 1  # Move before mid, search left",
          "complexity": {
            "time": "O(log n · c)",
            "space": "O(1)",